{
  "schemaVersion": 2,
  "updaterSchemaVersion": 2,
  "version": "0.5.11",
  "entries": [
    {
      "source": ".codex/skills/asset-provenance-and-rights/SKILL.md",
      "logicalId": "skill:asset-provenance-and-rights:SKILL.md",
      "ownership": "target-mapped",
      "targetTemplate": "{skillRoot}/asset-provenance-and-rights/SKILL.md",
      "modes": [
        "init",
        "update"
      ],
      "projectTypes": [
        "new",
        "mature"
      ],
      "conflictPolicy": "semantic-merge",
      "sha256": "32933d322311b7bf23eec7e65c07f619e2b467ccb5f8de9169ccf7e0103dee8a"
    },
    {
      "source": ".codex/skills/game-accessibility/SKILL.md",
      "logicalId": "skill:game-accessibility:SKILL.md",
      "ownership": "target-mapped",
      "targetTemplate": "{skillRoot}/game-accessibility/SKILL.md",
      "modes": [
        "init",
        "update"
      ],
      "projectTypes": [
        "new",
        "mature"
      ],
      "conflictPolicy": "semantic-merge",
      "sha256": "ccde8da6c1eaeb09b29fb3f1b123f32a3d11cbb113cb92a877037dee4b2efac3"
    },
    {
      "source": ".codex/skills/game-audio-quality/ORIGIN.md",
      "logicalId": "skill:game-audio-quality:ORIGIN.md",
      "ownership": "target-mapped",
      "targetTemplate": "{skillRoot}/game-audio-quality/ORIGIN.md",
      "modes": [
        "init",
        "update"
      ],
      "projectTypes": [
        "new",
        "mature"
      ],
      "conflictPolicy": "semantic-merge",
      "sha256": "a0b48060cff31a542fbf47333ffcdabc748373dd176f3ac4963e08249d2cda75"
    },
    {
      "source": ".codex/skills/game-audio-quality/SKILL.md",
      "logicalId": "skill:game-audio-quality:SKILL.md",
      "ownership": "target-mapped",
      "targetTemplate": "{skillRoot}/game-audio-quality/SKILL.md",
      "modes": [
        "init",
        "update"
      ],
      "projectTypes": [
        "new",
        "mature"
      ],
      "conflictPolicy": "semantic-merge",
      "sha256": "124929333f72b7e44e079d22704ac90441f59bb2e44a68b1a14011daa91069cc"
    },
    {
      "source": ".codex/skills/game-feel-polish/SKILL.md",
      "logicalId": "skill:game-feel-polish:SKILL.md",
      "ownership": "target-mapped",
      "targetTemplate": "{skillRoot}/game-feel-polish/SKILL.md",
      "modes": [
        "init",
        "update"
      ],
      "projectTypes": [
        "new",
        "mature"
      ],
      "conflictPolicy": "semantic-merge",
      "sha256": "855efc0085253e080368c9e6284648a3748e7204bcaf1d96a84575c8581c2b11"
    },
    {
      "source": ".codex/skills/game-performance-budget/SKILL.md",
      "logicalId": "skill:game-performance-budget:SKILL.md",
      "ownership": "target-mapped",
      "targetTemplate": "{skillRoot}/game-performance-budget/SKILL.md",
      "modes": [
        "init",
        "update"
      ],
      "projectTypes": [
        "new",
        "mature"
      ],
      "conflictPolicy": "semantic-merge",
      "sha256": "afce5be9092db1d82003f53da44c554633d3383c677c2793d901403137657a31"
    },
    {
      "source": ".codex/skills/implementation-cycle/SKILL.md",
      "logicalId": "skill:implementation-cycle:SKILL.md",
      "ownership": "target-mapped",
      "targetTemplate": "{skillRoot}/implementation-cycle/SKILL.md",
      "modes": [
        "init",
        "update"
      ],
      "projectTypes": [
        "new",
        "mature"
      ],
      "conflictPolicy": "semantic-merge",
      "sha256": "385693df974aa2fedb2ce609f149a2b0f4e1c38924cb4ea6315a8a08f008e856"
    },
    {
      "source": ".codex/skills/codex-engineering-system/SKILL.md",
      "logicalId": "skill:codex-engineering-system:SKILL.md",
      "ownership": "target-mapped",
      "targetTemplate": "{skillRoot}/codex-engineering-system/SKILL.md",
      "modes": [
        "init",
        "update"
      ],
      "projectTypes": [
        "new",
        "mature"
      ],
      "conflictPolicy": "semantic-merge",
      "sha256": "2eb5ce88ce30d1ab65b14d299d4d570351b2429b416d237906a7a9b011853535"
    },
    {
      "source": ".codex/skills/project-termination/SKILL.md",
      "logicalId": "skill:project-termination:SKILL.md",
      "ownership": "target-mapped",
      "targetTemplate": "{skillRoot}/project-termination/SKILL.md",
      "modes": [
        "init",
        "update"
      ],
      "projectTypes": [
        "new",
        "mature"
      ],
      "conflictPolicy": "semantic-merge",
      "sha256": "994781a48d044138eeeb876a0cb1b70618d6b6f328aafbe2041a0fa382bde658"
    },
    {
      "source": ".codex/skills/level-design-quality/SKILL.md",
      "logicalId": "skill:level-design-quality:SKILL.md",
      "ownership": "target-mapped",
      "targetTemplate": "{skillRoot}/level-design-quality/SKILL.md",
      "modes": [
        "init",
        "update"
      ],
      "projectTypes": [
        "new",
        "mature"
      ],
      "conflictPolicy": "semantic-merge",
      "sha256": "7958d6d83f94ab87d89105c24d654047beb802fbad89c15fa7f157d9dfb50700"
    },
    {
      "source": ".codex/skills/mobile-game-ux/ORIGIN.md",
      "logicalId": "skill:mobile-game-ux:ORIGIN.md",
      "ownership": "target-mapped",
      "targetTemplate": "{skillRoot}/mobile-game-ux/ORIGIN.md",
      "modes": [
        "init",
        "update"
      ],
      "projectTypes": [
        "new",
        "mature"
      ],
      "conflictPolicy": "semantic-merge",
      "sha256": "398f6c0d59ebc3f5bad202bffdcab08a22b24e7717a09957957132e0b86f2276"
    },
    {
      "source": ".codex/skills/mobile-game-ux/SKILL.md",
      "logicalId": "skill:mobile-game-ux:SKILL.md",
      "ownership": "target-mapped",
      "targetTemplate": "{skillRoot}/mobile-game-ux/SKILL.md",
      "modes": [
        "init",
        "update"
      ],
      "projectTypes": [
        "new",
        "mature"
      ],
      "conflictPolicy": "semantic-merge",
      "sha256": "e8e8f697f53b7b9bb908c4762f2ea0e3c0adb5840b2ddba4706c513fdfa8176a"
    },
    {
      "source": ".codex/skills/product-quality-review/ORIGIN.md",
      "logicalId": "skill:product-quality-review:ORIGIN.md",
      "ownership": "target-mapped",
      "targetTemplate": "{skillRoot}/product-quality-review/ORIGIN.md",
      "modes": [
        "init",
        "update"
      ],
      "projectTypes": [
        "new",
        "mature"
      ],
      "conflictPolicy": "semantic-merge",
      "sha256": "32b7291c06f6232b6a9d6c40b5de3cabb4923acb11283e9b0301e72ea00abb22"
    },
    {
      "source": ".codex/skills/product-quality-review/SKILL.md",
      "logicalId": "skill:product-quality-review:SKILL.md",
      "ownership": "target-mapped",
      "targetTemplate": "{skillRoot}/product-quality-review/SKILL.md",
      "modes": [
        "init",
        "update"
      ],
      "projectTypes": [
        "new",
        "mature"
      ],
      "conflictPolicy": "semantic-merge",
      "sha256": "a105fa55f719a2fecab4c11fd04839418c125589ee4ad6d48da8e56d14643bdc"
    },
    {
      "source": ".codex/skills/release-audit/SKILL.md",
      "logicalId": "skill:release-audit:SKILL.md",
      "ownership": "target-mapped",
      "targetTemplate": "{skillRoot}/release-audit/SKILL.md",
      "modes": [
        "init",
        "update"
      ],
      "projectTypes": [
        "new",
        "mature"
      ],
      "conflictPolicy": "semantic-merge",
      "sha256": "c4e844fbc8bb0252947f2237e1ea3b8dd3449721d292faa869c3ccd7f5f3aa4f"
    },
    {
      "source": ".codex/skills/visual-quality-gate/ORIGIN.md",
      "logicalId": "skill:visual-quality-gate:ORIGIN.md",
      "ownership": "target-mapped",
      "targetTemplate": "{skillRoot}/visual-quality-gate/ORIGIN.md",
      "modes": [
        "init",
        "update"
      ],
      "projectTypes": [
        "new",
        "mature"
      ],
      "conflictPolicy": "semantic-merge",
      "sha256": "b0d99f1bbf7b46c6e3dc9992e538adc7f23ecf355ebd1cf775e3f349cc7bca0d"
    },
    {
      "source": ".codex/skills/visual-quality-gate/SKILL.md",
      "logicalId": "skill:visual-quality-gate:SKILL.md",
      "ownership": "target-mapped",
      "targetTemplate": "{skillRoot}/visual-quality-gate/SKILL.md",
      "modes": [
        "init",
        "update"
      ],
      "projectTypes": [
        "new",
        "mature"
      ],
      "conflictPolicy": "semantic-merge",
      "sha256": "3ba7439308256729ac7a6b473278f3b05c65247fcb3c1c26f0f16f672aa55dfb"
    },
    {
      "source": ".codex/skills/web-game-playtest/ORIGIN.md",
      "logicalId": "skill:web-game-playtest:ORIGIN.md",
      "ownership": "target-mapped",
      "targetTemplate": "{skillRoot}/web-game-playtest/ORIGIN.md",
      "modes": [
        "init",
        "update"
      ],
      "projectTypes": [
        "new",
        "mature"
      ],
      "conflictPolicy": "semantic-merge",
      "sha256": "979d9e8fabe516b571b3ca0213169120da4730d6d1c11451235adc937cb2a82a"
    },
    {
      "source": ".codex/skills/web-game-playtest/SKILL.md",
      "logicalId": "skill:web-game-playtest:SKILL.md",
      "ownership": "target-mapped",
      "targetTemplate": "{skillRoot}/web-game-playtest/SKILL.md",
      "modes": [
        "init",
        "update"
      ],
      "projectTypes": [
        "new",
        "mature"
      ],
      "conflictPolicy": "semantic-merge",
      "sha256": "af5a75584e6656e3c0271310b136a610ee290805ee25b0e149394dcd4ea4d66e"
    },
    {
      "source": ".codex/skills/yandex-release-validation/SKILL.md",
      "logicalId": "skill:yandex-release-validation:SKILL.md",
      "ownership": "target-mapped",
      "targetTemplate": "{skillRoot}/yandex-release-validation/SKILL.md",
      "modes": [
        "init",
        "update"
      ],
      "projectTypes": [
        "new",
        "mature"
      ],
      "conflictPolicy": "semantic-merge",
      "sha256": "6c6d528fd9d6733d72e79ab0091f56f48bd2608705fd05252a1d90dc4fc4f69f"
    },
    {
      "source": "AGENTS.md",
      "logicalId": "contract:AGENTS.md",
      "ownership": "semantic-merge",
      "target": "AGENTS.md",
      "modes": [
        "init",